index,url,valid,domain,title,description,image,published,archive,content,quote,language,keyword
102,https://www.theverge.com/news/808749/tiktok-smart-split-ai-outline-revenue-sharing-subscriptions,0,www.theverge.com,TikTok can use AI to turn your long video into short ones,"TikTok announced three new features at its US Creator Summit yesterday. They include an update to revenue sharing for creators that offer subscriptions plus tools that can help with both the early planning stages of a video, and the process of editing longer …",https://platform.theverge.com/wp-content/uploads/sites/2/2025/10/tiktok1.jpg?quality=90&strip=all&crop=0%2C10.732984293194%2C100%2C78.534031413613&w=1200,2025-10-29T13:45:01Z,,"<ul><li></li><li></li><li></li></ul>
Smart Split automatically turns videos longer than a minute into bite-size clips reframed vertically for phones.
Smart Split automatically turns videos longer t… [+3355 chars]",,en,'US'
103,https://gizmodo.com/scientists-find-6-million-year-old-air-trapped-in-earths-oldest-known-ice-2000678848,0,gizmodo.com,Scientists Find 6-Million-Year-Old Air Trapped in Earth’s Oldest Known Ice,"The ice sample, retrieved in Antarctica, is the oldest on record—but this discovery may just be tip of the iceberg.",https://gizmodo.com/app/uploads/2025/10/main-raising-the-foro-drill-oldest-ice-antarctica-1200x675.jpg,2025-10-29T20:10:27Z,,"Science likes to travel far in search of new phenomena, but nature keeps reminding us that, really, weve yet to discover many things much closer to us. That was a clear lesson for researchers who dug… [+3859 chars]",,en,'Antarctica'
104,https://www.bbc.com/news/articles/cx2nq9v4819o?xtor=AL-72-%5Bpartner%5D-%5Byahoo.north.america%5D-%5Bheadline%5D-%5Bnews%5D-%5Bbizdev%5D-%5Bisapi%5D,0,www.bbc.com,'I haven't heard from my mum since Hurricane Melissa',Jamaicans in the north west of England say they are anxious to hear from loved ones after the hurricane.,https://media.zenfs.com/en/bbc_us_articles_995/b9ca737a2422e08997557317403b83a4,2025-10-29T21:10:47Z,,"Paula Robinson said her mum told her 'if you never hear my voice again, just know I love you' [BBC]
A woman who fears the place she grew up in ""could have been flattened"" in Hurricane Melissa is one… [+3506 chars]",,en,'Heard Island'
105,https://www.miamiherald.com/news/nation-world/world/americas/article312695646.html,0,www.miamiherald.com,‘Unprecedented devastation’ in Jamaica from Hurricane Melissa hampers aid efforts,"As a powerful Hurricane Melissa continued its destructive path through the Caribbean and into the Atlantic on Wednesday, Jamaica began the arduous task of...",https://media.zenfs.com/en/miami_herald_mcclatchy_975/558748789fe077917a3ab44294d6a1f9,2025-10-29T22:20:23Z,,"As a powerful Hurricane Melissa continued its destructive path through the Caribbean and into the Atlantic on Wednesday, Jamaica began the arduous task of trying to assess what one United Nations off… [+5068 chars]",,en,'French Southern Territories'
106,https://www.businessinsider.com/miss-universe-pageant-new-ceo-mario-bucaro-anne-jakrajutatip-replaced-2025-10,0,www.businessinsider.com,Miss Universe announces a new CEO just days before contestants are set to arrive in Thailand for the 2025 pageant,"Anne Jakrajutatip was replaced as CEO of Miss Universe by Mario Búcaro, who was the pageant's vice president for international relations.",https://i.insider.com/690266770be9845f2dc554bd?width=1200&format=jpeg,2025-10-29T23:16:24Z,,"Anne Jakrajutatip is no longer Miss Universe's CEO.Josh Brasted/Getty Images
<ul><li>Anne Jakrajutatip has been replaced as CEO of Miss Universe, which she bought in 2022.</li><li>Mario Búcaro, the … [+7064 chars]",,en,'USA'
107,https://www.bbc.com/news/articles/cy0kvrnyy4wo,0,www.bbc.com,Hurricane Melissa leaves dozens dead and trail of destruction across Caribbean,"The hurricane was downgraded from a category five storm on Wednesday after it made landfall in Jamaica a day earlier as its strongest-ever storm, decimating crucial infrastructure in its wake.",https://ichef.bbci.co.uk/news/1024/branded_news/2d82/live/f3184f50-b516-11f0-aa13-0b0479f6f42a.jpg,2025-10-29T23:49:34Z,,"Watch: Aftermath of Hurricane Melissa as Montego Bay devastated
Hurricane Melissa has continued its devastating sweep across the Caribbean, decimating homes and infrastructure, flooding neighbourhoo… [+4410 chars]",,en,'United States'
108,https://www.jalopnik.com/2011577/volvo-vnl-semi-truck-review/,0,www.jalopnik.com,"Anyone Can Drive Volvo's New VNL Semi Truck, But That Won't Make You A Trucker",The only gig tougher than driving these trucks might be selling these made-in-the-USA trucks in Trump's America.,https://www.jalopnik.com/img/gallery/anyone-can-drive-volvos-new-vnl-semi-truck-but-that-wont-make-you-a-trucker/l-intro-1761767903.jpg,2025-10-30T15:25:00Z,,"As for living in the truck, there are so many cubbys and netted spots to put all your stuff into that the VNL puts VanLifers to shame. The trucks we tested came with a mini fridge and microwave. Not … [+1677 chars]",,en,'USA'
109,https://www.livescience.com/animals/extinct-species/ancient-frosty-rhino-from-canadas-high-arctic-rewrites-what-scientists-thought-they-knew-about-the-north-atlantic-land-bridge,0,www.livescience.com,Ancient 'frosty' rhino from Canada's High Arctic rewrites what scientists thought they knew about the North Atlantic Land Bridge,"Researchers have gained new insights into rhinoceros evolution and the longevity of the North Atlantic Land Bridge from analyzing the perfectly preserved fossils of a ""frosty"" Arctic rhino.",https://cdn.mos.cms.futurecdn.net/27LzWoiGtuGLJRtRv3vvpQ-910-80.jpg,2025-10-30T17:15:00Z,http://web.archive.org/web/20251031192928/https://www.livescience.com/animals/extinct-species/ancient-frosty-rhino-from-canadas-high-arctic-rewrites-what-scientists-thought-they-knew-about-the-north-atlantic-land-bridge,"Almost four decades ago, researchers discovered a collection of perfectly preserved fossils inside an impact crater in the Canadian High Arctic. Now, those remains have finally yielded their secrets,… [+4593 chars]",,en,'Canada'
110,http://wwd.com/business-news/retail/canada-goose-paris-flagship-luxury-retail-concept-1238330616/,0,wwd.com,Canada Goose Unveils Paris Flagship as the First of Its ‘2.0’ Luxury Retail Concept,The Champs-Élysées flagship is the first location of Canada Goose’s new retail format and a key step in its strategy to grow direct-to-consumer sales and expand its European footprint.,https://wwd.com/wp-content/uploads/2025/10/CANADA_GOOSE_CHAMPS_ELYSEES_CAT13280plate.jpg?w=1000&h=563&crop=1,2025-10-30T17:41:48Z,,"PARIS —Canada Goose is ready to soar.
The outerwear brand has unveiled its ambitious retail concept with the opening of its flagship on Avenue des Champs-Élysées, marking the kickoff of its reboot a… [+7771 chars]",,en,'Canada'
111,https://www.bbc.com/news/articles/cly199pygy2o,0,www.bbc.com,Before and after: Satellite images reveal hurricane devastation in Jamaica,The images reveal how the Category 5 hurricane caused devastation in some of  Jamaica's communities.,https://ichef.bbci.co.uk/news/1024/branded_news/8c03/live/db332160-b5b3-11f0-aa13-0b0479f6f42a.png,2025-10-30T18:04:49Z,,"Nick Beake,BBC Verify USA Correspondent and 
Thomas Copeland,BBC Verify
With power down, problems with communications and navigating parts of the island treacherous, the authorities in Jamaica have… [+2509 chars]",,en,'West Island'
112,https://www.nationalgeographic.com/travel/article/best-way-to-see-seychelles-off-grid-luxury-cruise,0,www.nationalgeographic.com,This Seychelles cruise skips the resorts and goes off-grid,"The aquamarine waters and granite, boulder-clad islands of Seychelles have long beckoned travellers. And now, a new small-ship cruise lets visitors explore these paradise islands in total luxury.",https://i.natgeofe.com/n/0d4bdf18-f59a-4176-bc0a-f9ddb658518f/seychelles_yacht_16x9.jpg?w=1200,2025-10-31T00:00:00Z,,"This article was produced by National Geographic Traveller (UK).
Perfect palms arcing over white, fine-grain sand; smooth, sparkling granite boulders rising along the rainforest-clad coastline; and … [+7950 chars]",,en,'Cocos Islands'
113,https://www.npr.org/2025/10/30/g-s1-95941/haiti-jamaica-cuba-hurricane-melissa-recovery,0,www.npr.org,"Haiti, Jamaica and Cuba pick up the pieces after Melissa's destruction","Communities across the northern Caribbean are dealing with the aftermath of Hurricane Melissa. The storm has left many without homes, power or communication.",https://npr.brightspotcdn.com/dims3/default/strip/false/crop/2939x1652+0+0/resize/1400/quality/100/format/jpeg/?url=http%3A%2F%2Fnpr-brightspot.s3.amazonaws.com%2F22%2Fd0%2F7a5cf4d149a39e0e95560fd1507c%2Fap25303771862686.jpg,2025-10-31T00:35:41Z,,"SANTIAGO DE CUBA, Cuba The rumble of large machinery, whine of chain saws and chopping of machetes echoed through communities across the northern Caribbean on Thursday as they dug out from the destru… [+6111 chars]",,en,'West Island'
114,https://www.rockpapershotgun.com/speedrunner-event-games-done-queer-kicks-off-today-raising-funds-for-lgbtq-legal-aid-by-lighting-diddy-kongs-butt-on-fire,0,www.rockpapershotgun.com,"Speedrunner event Games Done Queer kicks off today, raising funds for LGBTQ+ legal aid by lighting Diddy Kong's butt on fire","Brethren! Cease your prattling and pick up your GameCube controllers. It is time to start playing Eternal Darkness: Sanity's Requiem at an unhealthy velocity, while funding lawyers to uphold the legal rights of LGBTQ+ people in the USA. Read more",https://assetsio.gnwcdn.com/unnamed(2).png?width=1200&height=630&fit=crop&enable=upscale&auto=webp,2025-10-31T12:22:50Z,,"Brethren! Cease your prattling and pick up your GameCube controllers. It is time to start playing Eternal Darkness: Sanity's Requiem at an unhealthy velocity, while funding lawyers to uphold the lega… [+1610 chars]",,en,'USA'
115,https://dailycoffeenews.com/2025/10/31/weekly-coffee-news-supporting-air-traffic-controllers-pitcairn-coffee-project/,0,dailycoffeenews.com,Weekly Coffee News: Supporting Air Traffic Controllers + Pitcairn Coffee Project,"Roast Magazine’s Daily Coffee News is proud to maintain advertising partnerships with many of the world’s leading coffee companies, yet maintains a focus on fair and objective editorial content, with no sponsored content or native advertising.",https://dailycoffeenews.com/wp-content/uploads/2025/10/Boston-Logan-International-Airport-1.jpg,2025-10-31T13:07:10Z,,"Welcome to DCNs Weekly Coffee News! Subscribe here for all the latest coffee industry news. Also, check out the latest career opportunities at CoffeeIndustryJobs.com.
Air traffic controllers at Bost… [+7090 chars]",,en,'Pitcairn'
116,https://www.yahoo.com/news/articles/despair-spreads-across-historic-seaport-135716518.html,0,www.yahoo.com,Despair spreads across historic seaport in Jamaica that Hurricane Melissa demolished,The road from Jamaica’s capital to the seaside town of Black River was known for its lush bamboo forest that formed a natural tunnel and glowed green in the ...,https://s.yimg.com/ny/api/res/1.2/NAaLDod4.J3zIna3_lmTrA--/YXBwaWQ9aGlnaGxhbmRlcjt3PTEyMDA7aD04MDA7Y2Y9d2VicA--/https://media.zenfs.com/en/ap.org/d12072c2d4c9692eaa985ab14904ef8c,2025-10-31T13:57:16Z,,"BLACK RIVER, Jamaica (AP) The road from Jamaicas capital to the seaside town of Black River was known for its lush bamboo forest that formed a natural tunnel and glowed green in the bright sun.
But … [+4700 chars]",,en,'Jamaica'
117,http://www.nybooks.com/online/2025/10/31/the-solidarity-of-the-hopeful/,0,www.nybooks.com,The Solidarity of the Hopeful,"Living on the Spanish island of Mallorca in 1936, the French writer Georges Bernanos found himself engulfed by the civil war then raging across Spain. A Catholic, Bernanos was predisposed to favor Francisco Franco; Pope Pius XI, a fervent anticommunist, was s…",https://www.nybooks.com/wp-content/uploads/2025/10/Mishraetal202510_3.jpeg,2025-10-31T15:57:33Z,,"Living on the Spanish island of Mallorca in 1936, the French writer Georges Bernanos found himself engulfed by the civil war then raging across Spain. A Catholic, Bernanos was predisposed to favor Fr… [+18535 chars]",,en,'nan'
118,http://deadline.com/2025/10/valley-of-ashes-stephen-gaghan-jennifer-fox-gatsby-netflix-1236604043/,0,deadline.com,Stephen Gaghan Sells Feature Pitch For Modern ‘Great Gatsby’ Adaptation ‘Valley Of Ashes’ To Netflix,"EXCLUSIVE: Netflix has preemptively acquired Academy Award winner Stephen Gaghan’s pitch for Valley of Ashes, a contemporized, loose adaptation of The Great Gatsby set in San Francisco, on which he’s teaming with his Syriana producer Jennifer Fox. Specifics a…",https://deadline.com/wp-content/uploads/2025/10/Stephen-Gaghan-and-Jennifer-Fox.jpg?w=1024,2025-10-31T16:44:27Z,,"EXCLUSIVE:Netflix has preemptively acquired Academy Award winner Stephen Gaghan‘s pitch for Valley of Ashes, a contemporized, loose adaptation of The Great Gatsby set in San Francisco, on which he’s … [+2087 chars]",,en,'The Valley'
119,https://www.jezebel.com/usha-u-good,0,www.jezebel.com,"Usha, U Good??","At a Turning Point USA event on Wednesday, Vice President JD Vance said he’s working on converting her damned soul.",https://img.pastemagazine.com/wp-content/juploads/2025/10/Screenshot-2025-10-31-at-6.18.08-PM.jpg,2025-10-31T17:30:33Z,,"Im no fan of Usha Vance but it cant be easy living with a walking ick who steals your eyeliner, prefers couches over your company, and whose ballooned face haunts you everywhere you travel. And while… [+4453 chars]",,en,'USA'
