index,url,valid,domain,title,description,image,published,archive,content,quote,language,keyword
96,https://www.cbsnews.com/news/pope-leo-xiv-film-industry-audience-vatican/,0,www.cbsnews.com,Pope Leo XIV celebrates the power of cinema with star-studded audience,"The event, organized by the Vatican's culture ministry, drew stars including Spike Lee, Cate Blanchett and Judd Apatow.",https://assets1.cbsnewsstatic.com/hub/i/r/2025/11/15/a46f79c3-5fb6-4bf0-a83b-7b2f9210ede9/thumbnail/1200x630/0f90957a46b4327e23a7bf5b0d6165a1/gettyimages-2246815404.jpg,2025-11-15T15:38:18Z,,"The Vatican shared the spotlight with Hollywood on Saturday as Pope Leo XIV hosted dozens of stars, including Cate Blanchett, Spike Lee and Monica Bellucci for a special audience celebrating the powe… [+3220 chars]",,en,'Vatican City'
97,http://deadline.com/2025/11/pope-leo-xiv-cinema-speech-a-list-crowd-read-his-speech-1236618389/,0,deadline.com,Pope Leo XIV Talks Movies To A-List Crowd At Vatican: Read His Speech,"EXCLUSIVE: Pope Leo XIV came to become head of the Catholic Church by way of Chicago. You’d expect him to be well versed in the ’85 Bears 4-6 defense, or the triangle offense of Michael Jordan’s Bulls. But algorithms? Who knew he might have such an understand…",https://deadline.com/wp-content/uploads/2025/11/GettyImages-2215662755.jpg?w=1024,2025-11-15T15:47:45Z,http://web.archive.org/web/20251116050337/https://deadline.com/2025/11/pope-leo-xiv-cinema-speech-a-list-crowd-read-his-speech-1236618389/,"EXCLUSIVE: Pope Leo XIV came to become head of the Catholic Church by way of Chicago. You’d expect him to be well versed in the ’85 Bears 4-6 defense, or the triangle offense of Michael Jordan’s Bull… [+8261 chars]",,en,'Vatican'
98,https://www.bbc.com/news/articles/cdxr5drrpqxo,0,www.bbc.com,Pope Leo welcomes Hollywood stars to the Vatican,"Pope Leo spoke to stars including Cate Blanchett, Spike Lee and Viggo Mortensen at the event for global cinema.",https://ichef.bbci.co.uk/news/1024/branded_news/30ea/live/86c877c0-c237-11f0-ae46-bd64331f0fd4.jpg,2025-11-15T16:06:45Z,http://web.archive.org/web/20251115163912/https://www.bbc.com/news/articles/cdxr5drrpqxo,"Sarah RainsfordSouthern and Eastern Europe correspondent, Rome
Pope Leo has held an audience with Hollywood stars, urging actors and directors including Cate Blanchett, Viggo Mortensen and Monica Be… [+3392 chars]",,en,'Vatican'
99,,en,'Vatican',,,,,,,,,
