index,url,valid,domain,title,description,image,published,archive,content,quote,language,keyword
0,https://www.aljazeera.com/news/2025/10/15/indonesias-mount-lewotobi-laki-laki-erupts-sends-volcanic-ash-10km-high,0,www.aljazeera.com,"Indonesia’s Mount Lewotobi Laki-Laki erupts, sends volcanic ash 10km high",Authorities warn locals and tourists to stay at least 6km away from the site of the volcano.,https://www.aljazeera.com/wp-content/uploads/2025/10/AFP__20250617__62NQ9XK__v3__HighRes__TopshotIndonesiaVolcano-1760500714.jpg?resize=1920%2C1440,2025-10-15T05:28:45Z,,"Authorities in Indonesia have raised the volcano emergency alert to its highest level after Mount Lewotobi Laki-Laki erupted, spewing volcanic ash an estimated 10km (6.2 miles) into the sky.
There w… [+1899 chars]",,en,'Indonesia'
1,https://www.breitbart.com/europe/2025/10/15/vatican-grants-muslim-plea-for-dedicated-prayer-room/,0,www.breitbart.com,Report: Vatican Grants Muslim Plea for Dedicated Prayer Room,"A dedicated prayer room for Muslims has reportedly been opened inside the 500-year-old Vatican Apostolic Library in Rome after a plea for the separate, carpeted space was made by visiting Islamic scholars.
The post Report: Vatican Grants Muslim Plea for Dedic…",https://media.breitbart.com/media/2025/10/muslim-prayers-640x335.jpg,2025-10-15T12:36:59Z,,"A dedicated prayer room for Muslims has reportedly been opened inside the 500-year-old Vatican Apostolic Library in Rome after a plea for the separate, carpeted space was made by visiting Islamic sch… [+1916 chars]",,en,'Vatican'
2,https://www.gsmarena.com/vivo_announces_that_originos_6_is_going_global-news-69920.php,0,www.gsmarena.com,vivo announces the global rollout of OriginOS,"Five years ago, vivo introduced OriginOS, its next generation OS that was set to replace FuntouchOS – and it did, but only in China. Until now. As you may have heard, OriginOS is going global.

This is happening with the newly-introduced version 6, which is b…",https://fdn.gsmarena.com/imgroot/news/25/10/vivo-originos-6-is-going-global/-952x498w6/gsmarena_000.jpg,2025-10-15T13:58:02Z,,"Five years ago, vivo introduced OriginOS, its next generation OS that was set to replace FuntouchOS and it did, but only in China. Until now. As you may have heard, OriginOS is going global.
This is… [+2086 chars]",,en,'China'
3,http://deadline.com/2025/10/doc-stories-2025-lineup-1236586965/,0,deadline.com,"Doc Stories Announces 2025 Festival Lineup: Oscar Contenders ‘Cover-Up,’ ‘My Mom Jayne,’ ‘The Eyes Of Ghana’ & More","Many of the year’s top Oscar-contending documentaries are set for exhibition at the 11th annual Doc Stories, the prestigious four-day cinematic event in San Francisco put on by SFFILM. Doc Stories, running from November 6-9, announced its lineup today, select…",https://deadline.com/wp-content/uploads/2025/10/Doc-Stories-split.png?w=1024,2025-10-15T17:00:00Z,,"Many of the year’s top Oscar-contending documentaries are set for exhibition at the 11th annual Doc Stories, the prestigious four-day cinematic event in San Francisco put on by SFFILM.
Doc Stories, … [+12069 chars]",,en,'Ghana'
4,https://www.tmz.com/2025/10/15/white-sox-praise-pope-leo-for-cubs-quip/,0,www.tmz.com,Chicago White Sox Praise Pope Leo XIV For Cubs 'Lost' Quip,The Chicago White Sox just heaped praise on Pope Leo XIV ... after he blessed their timeline with some Cubs shade!! The head of the Catholic Church threw a quick quip at the North Siders on Wednesday while at the Vatican ... when he responded to a…,https://imagez.tmz.com/image/47/16by9/2025/10/15/47cb3422e9a542458eeb1db205a63594_xl.jpg,2025-10-15T19:54:28Z,,"The Chicago White Sox just heaped praise on Pope Leo XIV ... after he blessed their timeline with some Cubs shade!!
The head of the Catholic Church threw a quick quip at the North Siders on Wednesda… [+750 chars]",,en,'Vatican'
5,https://www.bbc.co.uk/programmes/p0m8sz1n,0,www.bbc.co.uk,Fighting on two fronts,"More than a third of Ukraine’s scientific institutions have been damaged or destroyed by Russian bombing. Many scientists have either fled the country or are internally displaced, and that Ukraine’s National Academy of Sciences is trying to operate on half it…",https://ichef.bbci.co.uk/images/ic/1200x675/p0kxnkh5.jpg,2025-10-16T00:30:00Z,,"More than a third of Ukraines scientific institutions have been damaged or destroyed by Russian bombing. Many scientists have either fled the country or are internally displaced, and that Ukraines Na… [+634 chars]",,en,'Ukraine'
6,https://www.bbc.com/news/articles/cz6nw7819zlo?xtor=AL-72-%5Bpartner%5D-%5Byahoo.north.america%5D-%5Bheadline%5D-%5Bnews%5D-%5Bbizdev%5D-%5Bisapi%5D,0,www.bbc.com,Sir David Attenborough ship visits Plymouth,The RRS Sir David Attenborough docked in Plymouth to restock supplies before heading to Antarctica.,https://s.yimg.com/ny/api/res/1.2/TnV7SBgiGfOXpO2sCxI8eA--/YXBwaWQ9aGlnaGxhbmRlcjt3PTEyMDA7aD02NzU7Y2Y9d2VicA--/https://media.zenfs.com/en/bbc_us_articles_995/a090da42fade4509faca9ec67be56a9b,2025-10-16T05:04:12Z,,"A ship named after legendary broadcaster and writer Sir David Attenborough has stopped in Plymouth to take on supplies before heading to Antarctica.
The Royal Navy said RRS Sir David Attenborough, w… [+3244 chars]",,en,'Plymouth'
7,https://www.holidaypirates.com/cruises/luxury-15-night-antarctica-cruise,0,www.holidaypirates.com,Luxury 15-night Antarctica cruise with suite & butler ,"Pirates, check out this once-in-a-lifetime Antarctica cruise we've found departing next year.You'll depart from the south of Chile on a luxury cruise ship for 15 nights, starting from £9,889. Yes, this price is big, but we've seen the same sailing on other we…",https://image.urlaubspiraten.de/720/image/upload/v1637234919/mediavault_images/AdobeStock_46557859_nraewa.jpg,2025-10-16T11:09:58Z,,"Pirates, check out this once-in-a-lifetime Antarctica cruise we've found departing next year.
You'll depart from the south of Chile on a luxury cruise ship for 15 nights, starting from £9,889. Yes, … [+455 chars]",,en,'Antarctica'
8,https://www.upi.com/Top_News/World-News/2025/10/16/vatican-Catholic-abuse-reparations/8411760614480/,0,www.upi.com,"Vatican panel recommends financial, spiritual reparations for abuse victims",The Vatican's child protection advisory panel called for reparations to victims of clergy sexual abuse and sanctions on the abusers to help the victims heal.,https://media.zenfs.com/en/united_press_international_articles_356/92f2ebcab8f5cbd05372462243985569,2025-10-16T12:35:17Z,,"Oct. 16 (UPI) -- The Vatican's child protection advisory panel on Thursday called for reparations to victims of clergy sexual abuse and sanctions on the abusers to help the victims heal.
In addition… [+2040 chars]",,en,'Vatican'
9,http://deadline.com/2025/10/primate-trailer-1236588673/,0,deadline.com,‘Primate’: This Chimp Isn’t Monkeying Around In Trailer For Johannes Roberts Horror Movie – Watch,"Horror traditionally finds a place at the New Year’s winter box office after the Christmas tentpole (this year, Avatar: Fire & Ash) makes a tear, and in January that’s Paramount and 18Hz’s Primate. As you can see in the trailer, it can also be titled ‘Island …",https://deadline.com/wp-content/uploads/2025/08/PRIMATE_04708R-e1760619899876.jpg?w=1024,2025-10-16T13:08:27Z,,"Horror traditionally finds a place at the New Year’s winter box office after the Christmas tentpole (this year, Avatar: Fire &amp; Ash) makes a tear, and in January that’s Paramount and 18Hz’s Primat… [+645 chars]",,en,'Christmas Island'
10,https://www.pcgamer.com/games/strategy/final-fantasy-tactics-best-jobs/,0,www.pcgamer.com,"Every Final Fantasy Tactics job, rated","We grade the style, sass, shenanigans, and stoutness of Final Fantasy Tactics' 20 classes, and identify their best abilities.",https://cdn.mos.cms.futurecdn.net/wg7W2VCrPGGLYjb6V9zcFE-2560-80.jpg,2025-10-16T14:39:07Z,,"Do you know your Squires from your Mystics? Final Fantasy Tactics
 has finally made a home on PC, and its entire stable of jobs have come with it. While strategy RPG fans have been eating good for t… [+19203 chars]",,en,'Vatican City'
11,https://www.vox.com/climate/464782/peat-hudson-bay-peatlands-renewable-energy-critical-minerals-carbon-sink,0,www.vox.com,The humble plant that could save the world — or destroy it,"The largest herds of caribou in the world make their homes here. Polar bears give birth to cubs in dens dug into this soil, some of them more than 200 years old. And birds like the Arctic tern fly north every summer, some from as far south as Antarctica, to b…",https://platform.vox.com/wp-content/uploads/sites/2/2025/10/The-Water-Brothers-Wildlands-League.jpg?quality=90&strip=all&crop=0%2C10.732984293194%2C100%2C78.534031413613&w=1200,2025-10-16T14:53:22Z,,"The Hudson Bay peatlands are a haven for biodiversity and a powerful carbon sink. | ﻿The Water Brothers & Wildlands League


The largest herds of caribou in the world make their homes here. Polar be… [+12894 chars]",,en,'Antarctica'
12,https://www.thebrighterside.news/post/antarctic-microbe-has-major-food-cosmetic-and-medical-potential/,0,www.thebrighterside.news,"Antarctic microbe has major food, cosmetic, and medical potential","In one of Earth’s driest, most harsh environments, scientists uncovered a micro-miracle. Down in Fumarole Bay on Deception Island, Antarctica, scientists...",https://media.zenfs.com/en/the_brighter_side_of_news_articles_781/c1261d47103e22aceaa7bdbfded691ea,2025-10-16T16:07:00Z,,"In one of Earths driest, most harsh environments, scientists uncovered a micro-miracle. Down in Fumarole Bay on Deception Island, Antarctica, scientists discovered Bacillus licheniformis strain F2LBa… [+7632 chars]",,en,'Antarctica'
13,https://www.cbc.ca/news/canada/prince-edward-island/pei-calls-federal-investigation-money-laundering-foreign-interference-9.6941038,0,www.cbc.ca,P.E.I. calls for federal investigation into foreign interference allegations aimed at Buddhist groups,P.E.I. Premier Rob Lantz is calling on the federal RCMP and Canada's anti-money-laundering agency to begin “immediate and transparent” investigations into allegations of foreign interference and money laundering involving “certain Buddhist groups” on the Isla…,"https://i.cbc.ca/ais/2a001494-d641-4694-a8b6-dd05caafc904,1760635348751/full/max/0/default.jpg?im=Crop%2Crect%3D%280%2C0%2C1180%2C663%29%3BResize%3D620",2025-10-16T17:49:25Z,,P.E.I. Premier Rob Lantz is calling on the federal RCMP and Canada's anti-money-laundering agency to begin immediate and transparent investigations into allegations of foreign interference and money … [+6963 chars],,en,'Heard Island'
14,https://www.gov.uk/government/speeches/the-uk-is-committed-to-supporting-its-overseas-territories-to-deliver-their-priorities-uk-statement-at-the-un-fourth-committee,0,www.gov.uk,The UK is committed to supporting its Overseas Territories to deliver their priorities: UK Statement at the UN Fourth Committee,"Statement by Simon Thomas, UK Ambassador to the General Assembly, at the UN’s Special Political and Decolonisation Fourth Committee.",https://www.gov.uk/assets/frontend/govuk-opengraph-image-4196a4d6333cf92aaf720047f56cfd91b3532d7635fc21ebcf0d5897df6b5f77.png,2025-10-16T21:06:38Z,,Let me start by reiterating that the United Kingdom has a modern relationship with all its Overseas Territories based on partnership; on shared values; and on the right of the people of each Territor… [+4032 chars],,en,'South Georgia and the South Sandwich Islands'
15,https://www.aljazeera.com/news/2025/10/17/military-leader-randrianirina-sworn-in-as-madagascars-new-president,0,www.aljazeera.com,Military leader Randrianirina sworn in as Madagascar’s new president,Mass demonstrations in recent weeks over power and water shortages have killed more than 20 people.,https://www.aljazeera.com/wp-content/uploads/2025/10/ap_68f017b54dd47-1760565173.jpg?resize=1920%2C1440,2025-10-17T07:35:54Z,,"Madagascar has sworn in an army colonel as president, just days after a military takeover on the back of a popular rebellion that sent President Andry Rajoelina fleeing into exile.
The African islan… [+3447 chars]",,en,'Heard Island'
16,https://matadornetwork.com/read/where-to-go-in-germany-and-italy/,0,matadornetwork.com,"8 Can’t-Miss Experiences in Germany and Italy, According to Your Travel Style",Home to some of the most iconic cities on Earth — and easily accessible on Lufthansa — Germany and Italy have something for every traveler.,https://cdn1.matadornetwork.com/blogs/1/2025/10/shutterstock_2430385485-social.jpg,2025-10-17T14:00:00Z,,Home to some of the most iconic and historic cities anywhere — many of which Lufthansa flies to from major US hubs — Germany and Italy offer something for every type of traveler. Whether you’re looki… [+6285 chars],,en,'Italy'
17,https://www.forbes.com/sites/danielscheffler/2025/10/17/how-dorothy-drapers-imagination-defined-americas-grandest-hotels/,0,www.forbes.com,How Dorothy Draper’s Imagination Defined America’s Grandest Hotels,"From the Greenbrier in West Virginia to Mackinac Island’s Grand Hotel, Dorothy Draper’s bold, joyous style has defined a century of American interior design.",https://imageio.forbes.com/specials-images/imageserve/68f251af1257ab8e0f86ea3f/0x0.jpg?format=jpg&height=900&width=1600&fit=bounds,2025-10-17T14:38:37Z,,"Parlor time at the Grand Hotel
Grand Hotel
When you step off the ferry onto Mackinac Island, time slows. Horses clip-clop past, flowers spill over balconies, and the scent of fudge drifts across th… [+9073 chars]",,en,'West Island'
18,https://www.marieclaire.com/celebrity/royals/king-charles-makes-history-first-monarch-500-years-honor/,0,www.marieclaire.com,King Charles Will Make History and Become First British Monarch in 500 Years to Carry Out This Special Honor,The King's big moment will happen when he travels to Vatican City next week.,https://media.zenfs.com/en/marie_claire_us_340/3db4b1ed729f0bac25516315a1d59806,2025-10-17T16:56:02Z,,"When you buy through links on our articles, Future and its syndication partners may earn a commission.
King Charles and Queen Camilla will travel to the Vatican to meet Pope Leo XIV for the first ti… [+1789 chars]",,en,'Vatican City'
19,https://www.abc.net.au/news/2025-10-18/christmas-island-travellers-luggage-regularly-left-behind/105778992,0,www.abc.net.au,Why some tourists visiting this holiday destination never get their bags,"On Christmas Island, locals are not surprised if tourists' checked baggage does not arrive with them. Fragile supply chains on the remote Indian Ocean island are a part of life in this unique community.",https://live-production.wcms.abc-cdn.net.au/c2780817d6bda35c4d8cb75c054b558a?impolicy=wcms_watermark_news&cropH=2813&cropW=5000&xPos=0&yPos=344&width=862&height=485&imformat=generic,2025-10-17T21:09:28Z,,"The promise of a rugged, tropical island paradise sprawling with unique wildlife attracts visitors from far and wide to Christmas Island, but many travellers are shocked when their checked luggage do… [+6290 chars]",,en,'Christmas Island'
20,https://www.theverge.com/news/802070/nuclear-fusion-energy-ai-trump-roadmap,0,www.theverge.com,"The US has a new roadmap for fusion energy, without the funds to back it up",The Department of Energy (DOE) released a new roadmap for the US to realize the decades-long dream of harnessing fusion energy. It’s a commitment to support research and development efforts and pursue public-private partnerships to finally build the first gen…,https://platform.theverge.com/wp-content/uploads/sites/2/2025/10/gettyimages-1448790394.jpg?quality=90&strip=all&crop=0%2C10.73652856756%2C100%2C78.52694286488&w=1200,2025-10-17T22:21:39Z,,"<ul><li></li><li></li><li></li></ul>
Its an ambitious timeline thats light on details.
Its an ambitious timeline thats light on details.
by
Justine CalmaClose
Justine Calma
Posts from this auth… [+6200 chars]",,en,'US'
21,https://www.bbc.com/news/articles/cn8xg1jve73o,0,www.bbc.com,"US to repatriate survivors of strike on 'drug-carrying submarine', Trump says",The latest attack is at least the sixth US strike on Venezuelan ships in recent weeks.,https://ichef.bbci.co.uk/news/1024/branded_news/d1a8/live/9185be50-ac5e-11f0-ba75-093eca1ac29b.jpg,2025-10-18T20:42:39Z,,"President Donald Trump has said the US will return two people who survived a strike on what he called a ""drug-carrying submarine"" to their countries of origin, Ecuador and Colombia.
Writing on socia… [+2435 chars]",,en,'US'
22,https://www.aljazeera.com/sports/2025/10/19/raul-fernandez-wins-first-motogp-at-australian-grand-prix,0,www.aljazeera.com,Raul Fernandez wins first MotoGP at Australian Grand Prix,Fernandez becomes the seventh different winner this season with a maiden MotoGP victory at the Phillip Island circuit.,https://www.aljazeera.com/wp-content/uploads/2025/10/AFP__20251019__79AJ8M6__v2__HighRes__TopshotMotoPrixAusMotogpPodium-1760857018_383990-1760857176.jpg?resize=1200%2C630&quality=80,2025-10-19T07:25:42Z,,"Raul Fernandez delivered a dominant performance to claim his maiden MotoGP victory at the Australian Grand Prix on Sunday, securing a first-ever triumph for Trackhouse Racing in the premier class.
S… [+2513 chars]",,en,'nan'
23,https://www.aljazeera.com/news/2025/10/19/five-dead-two-missing-as-tropical-storm-fengshen-soaks-philippines,0,www.aljazeera.com,"Five dead, two missing as Tropical Storm Fengshen soaks Philippines","Heavy flooding reported in several central Philippine islands, including Samar and Panay, forcing thousands to evacuate.",https://www.aljazeera.com/wp-content/uploads/2025/10/2025-10-04T133855Z_2120736150_RC2Q4HAG7HH2_RTRMADP_3_ASIA-WEATHER-PHILIPPINES-1760858122.jpg?resize=1920%2C1440,2025-10-19T07:40:23Z,,"At least five people have been killed and two reported missing as Tropical Storm Fengshen sweeps through the Philippines, triggering heavy flooding on the main island of Luzon and a vast landslide on… [+2866 chars]",,en,'West Island'
24,https://www.bbc.com/news/articles/c051p3981m4o,0,www.bbc.com,Vance celebrates US Marines 250th anniversary with live artillery demo,"California governor Gavin Newsom shutdown a busy freeway, saying the military demonstration was too dangerous.",https://ichef.bbci.co.uk/news/1024/branded_news/3f43/live/9e60f180-acef-11f0-b2a1-6f537f66f9aa.jpg,2025-10-19T13:30:12Z,,"Vice President JD Vance celebrated the 250th anniversary of the US Marine Corps at an event that included a live artillery demonstration.
That demonstration - which took place at Camp Pendleton in S… [+2832 chars]",,en,'US'
25,https://www.mentalfloss.com/language/words/why-new-zealanders-are-called-kiwis,0,www.mentalfloss.com,Why Are New Zealanders Called ‘Kiwis’?,The answer involves World War I soldiers and a cute bird.,"https://images2.minutemediacdn.com/image/upload/c_crop,x_0,y_310,w_3969,h_2232/c_fill,w_1440,ar_1440:810,f_auto,q_auto,g_auto/images/GettyImages/mmsport/mentalfloss/01k6x1xnn3ap5cbdr9as.jpg",2025-10-20T14:01:00Z,,"Youve likely heard the term New Zealander referring to people living in the island nation east of Australia. However, they often go by the name Kiwi as well. If youre curious where the moniker comes … [+1448 chars]",,en,'New Zealand'
26,https://www.cbsnews.com/news/new-saints-pope-leo-ex-satanic-priest-doctor-of-the-poor/,0,www.cbsnews.com,Ex-Satanic priest among 7 new saints created by Pope Leo XIV,Pope Leo XIV created seven new saints on Sunday during a ceremony at the Vatican.,https://assets3.cbsnewsstatic.com/hub/i/r/2025/10/20/ff25e55a-6a4e-4479-a342-70aaed4383fc/thumbnail/1200x630/cfeca32954e2633bff9f8a8db69d7b9a/2025-10-19t074423z-1717706093-rc2vehaj6ti7-rtrmadp-3-pope-mass-saints.jpg,2025-10-20T14:35:01Z,,"Pope Leo XIV has created seven new saints, bringing the total number of people who posthumously received this title to nine since he was appointed to lead the Catholic Church earlier this year. Among… [+4632 chars]",,en,'Vatican'
27,https://www.schneier.com/blog/archives/2025/10/first-wap-a-surveillance-computer-youve-never-heard-of.html,0,www.schneier.com,First Wap: A Surveillance Computer You’ve Never Heard Of,"Mother Jones has a long article on surveillance arms manufacturers, their wares, and how they avoid export control laws:
Operating from their base in Jakarta, where permissive export laws have allowed their surveillance business to flourish, First Wap’s Europ…",,2025-10-20T19:00:09Z,,"Mother Jones has a long article on surveillance arms manufacturers, their wares, and how they avoid export control laws:
Operating from their base in Jakarta, where permissive export laws have allowe… [+1271 chars]",,en,'Jakarta'
28,https://mvdirona.com/2025/10/the-falklands-south-georgia-and-antarctica-part-ii/,0,mvdirona.com,"The Falklands, South Georgia, and Antarctica Part II","Departing the Falklands, we traveled 900nm over three nights to reach our first stop in South Georgia at Elsehul. Here we toured the area by tender, sighting a large rockhopper penguin rookery perched on the cliffs, and hundreds of baby and adult seals. Among…",https://mvdirona.com/cache/600x450-0/wp-content/gallery/20241230-st-andrews-bay/IMG_6026_web.jpg,2025-10-20T21:21:47Z,,"Departing the Falklands, we traveled 900nm over three nights to reach our first stop in South Georgia at Elsehul. Here we toured the area by tender, sighting a large rockhopper penguin rookery perche… [+3034 chars]",,en,'Antarctica'
29,https://www.nature.com/articles/s41467-025-64330-0,0,www.nature.com,"Rapid retreat of Berry Glacier, West Antarctica, linked to seawater intrusions revealed by radar interferometry","Satellite radar interferometry reveals the dramatic retreat of Berry Glacier in West Antarctica. Broad intrusions of warm subsurface water, funneled by seafloor channels along retrograde bed slopes, have driven intense basal melting of the ice, which triggere…",https://media.springernature.com/m685/springer-static/image/art%3A10.1038%2Fs41467-025-64330-0/MediaObjects/41467_2025_64330_Fig1_HTML.png,2025-10-21T00:00:00Z,,"Grounding line migration
Using a time series of InSAR data, we find that the length of the IGZ increased from 0.6 km in 1995/1996 to 18.0 ± 0.9 km in 20192021 (Fig. 1). Because we have only two inte… [+19379 chars]",,en,'Antarctica'
30,https://unchartedterritories.tomaspueyo.com/p/argentina-could-be-a-superpower,0,unchartedterritories.tomaspueyo.com,Argentina Could Be a Superpower,Its geography could have made it the United States of Latin America,"https://substackcdn.com/image/fetch/$s_!2UQQ!,w_1200,h_600,c_fill,f_jpg,q_auto:good,fl_progressive:steep,g_auto/https%3A%2F%2Fsubstack-post-media.s3.amazonaws.com%2Fpublic%2Fimages%2F5574b2c1-cebb-41f6-9163-6ffe7b79bc1f_778x1080.gif",2025-10-21T01:06:55Z,,"Encuentra este artículo en español debajo del inglés.
Argentina used to be rich:
Its capital, Buenos Aires, was the Paris of South America.
For decades, Argentina (which means the country of silve… [+26025 chars]",,en,'United States'
31,https://www.forbes.com/sites/carleyrojasavila/2025/10/20/inside-the-caribbean-food-festivals-elevating-the-regions-culinary-profile-and-how-to-visit/,0,www.forbes.com,Inside The Caribbean Food Festivals Elevating The Region’s Culinary Profile—And How To Visit,"Diverse and delicious, Caribbean cuisine is one worth trying at the source. These are the standout food festivals showcasing the region’s rich culinary identity.",https://imageio.forbes.com/specials-images/imageserve/68ee6ab7d6f5519e8d1eaa6b/0x0.jpg?format=jpg&height=900&width=1600&fit=bounds,2025-10-21T02:17:58Z,,"Caribbean food will surprise you, more than ever at the many food festivals across the region that highlight all its unique origins and expressions.
Puerto Rico Wine &amp; Food Festival
As warm wea… [+11296 chars]",,en,'Saint Eustatius'
32,https://www.theverge.com/news/803257/amazon-robotics-automation-replace-600000-human-jobs,0,www.theverge.com,"Amazon hopes to replace 600,000 US workers with robots, according to leaked documents","Amazon is reportedly leaning into automation plans that will enable the company to avoid hiring more than half a million US workers. Citing interviews and internal strategy documents, The New York Times reports that Amazon is hoping its robots can replace mor…",https://platform.theverge.com/wp-content/uploads/sites/2/2025/10/gettyimages-1732217960.jpg?quality=90&strip=all&crop=0%2C10.732984293194%2C100%2C78.534031413613&w=1200,2025-10-21T11:11:19Z,,"<ul><li></li><li></li><li></li></ul>
Job losses could shave 30 cents off each item purchased by 2027.
Job losses could shave 30 cents off each item purchased by 2027.
by
Jess WeatherbedClose
Jes… [+2962 chars]",,en,'US'
33,https://www.yahoo.com/news/articles/ferocious-predator-defied-expectations-offered-115400162.html,0,www.yahoo.com,The Ferocious Predator Who Defied Expectations — and Offered Me Dinner,A journey into the wild beauty of Antarctica for a face-to-face with a leopard seal.,https://s.yimg.com/ny/api/res/1.2/2Nwwy0D8qU5SJHxCcfQq_A--/YXBwaWQ9aGlnaGxhbmRlcjt3PTEyMDA7aD03NDA7Y2Y9d2VicA--/https://media.zenfs.com/en/katie_couric_media_articles_233/267e4292bbd598d2cd09748b56ff7154,2025-10-21T11:54:00Z,,"I sometimes imagine what that final journey at the end of my life will look like. I picture myself on my deathbed, surrounded by loved ones, thinking of the many adventures Ive had as a photographer … [+5497 chars]",,en,'Antarctica'
