index,url,valid,domain,title,description,image,published,archive,content,quote,language,keyword
69,https://www.abc.net.au/news/2025-10-27/lachlan-strahan-diplomat-solomon-islands-china-foreign-affairs/105933764,0,www.abc.net.au,Diplomat's memoir gives an insider's look at Solomon Islands-China deal,"Former diplomat Lachlan Strahan used his memoir to criticise parts of the Coalition government's response to Solomon Islands' 2022 deal with China, while revealing some Australian officials pushed to impose ""punitive"" measures on Solomon Islands if it deepene…",https://live-production.wcms.abc-cdn.net.au/4553b690122c61622ce4ff472b89e67e?impolicy=wcms_watermark_news&cropH=720&cropW=1280&xPos=0&yPos=66&width=862&height=485&imformat=generic,2025-10-26T20:48:48Z,,The former official who was Australia's top diplomat in Solomon Islands when the Pacific nation signed a deeply contentious security agreement with China says Labor was wrong to claim it could have s… [+9245 chars],,en,'McDonald Islands'
70,https://www.scientificamerican.com/article/why-hurricane-melissa-could-be-the-worst-storm-to-ever-hit-jamaica/,0,www.scientificamerican.com,Why Hurricane Melissa Could Be the Worst Storm to Ever Hit Jamaica,"Category 5 Hurricane Melissa’s exceptional strength and slow pace could make it more destructive than Hurricane Gilbert, which hit Jamaica in 1988",https://static.scientificamerican.com/dam/m/50c7f60c78dceee6/original/GettyImages-2243186140-Melissa-prep-web.jpeg?m=1761598902.389&w=1200,2025-10-27T04:00:00Z,,"As Category 5 hurricane Melissa bears down on Jamaica, it is poised to be the worst storm to ever hit the Caribbean island, surpassing the damage from Hurricane Gilbert in 1988.
Gilbert, which hit J… [+3929 chars]",,en,'Jamaica'
71,https://theconversation.com/fish-stocks-off-icy-heard-island-bounced-back-when-illegal-fishing-stopped-and-sustainable-fishing-continued-267866,0,theconversation.com,Fish stocks off icy Heard Island bounced back when illegal fishing stopped and sustainable fishing continued,"For years, illegal fishing vessels operated near Australia’s Heard and McDonald Islands. Here’s what happened after they were stopped.",https://images.theconversation.com/files/697655/original/file-20251021-56-dkx7al.jpeg?ixlib=rb-4.1.0&rect=0%2C416%2C2048%2C1024&q=45&auto=format&w=1356&h=668&fit=crop,2025-10-27T05:06:36Z,,In the middle of the Southern Indian Ocean lies a vast underwater volcanic ridge known as the Kerguelen Plateau. At its centre sits Australia’s most remote territory: Heard Island and McDonald Island… [+5350 chars],,en,'Heard Island and McDonald Islands'
72,https://theconversation.com/fish-species-off-icy-heard-island-bounced-back-when-illegal-fishing-stopped-and-sustainable-fishing-continued-267866,0,theconversation.com,Fish species off icy Heard Island bounced back when illegal fishing stopped and sustainable fishing continued,"For years, illegal fishing vessels operated near Australia’s Heard and McDonald Islands. Here’s what happened after they were stopped.",https://images.theconversation.com/files/697655/original/file-20251021-56-dkx7al.jpeg?ixlib=rb-4.1.0&rect=0%2C416%2C2048%2C1024&q=45&auto=format&w=1356&h=668&fit=crop,2025-10-27T05:06:36Z,,In the middle of the Southern Indian Ocean lies a vast underwater volcanic ridge known as the Kerguelen Plateau. At its centre sits Australia’s most remote territory: Heard Island and McDonald Island… [+5348 chars],,en,'Australia'
73,https://everything-everywhere.com/challenger-deep-and-the-mariana-trench/,0,everything-everywhere.com,Challenger Deep and the Mariana Trench,"Podcast Transcript Located in an arc sweeping to the east and south of the Marina Islands and Guam is the deepest part of the ocean, the Mariana Trench.  Running over 2,500 kilometers or 1,200 miles, the very deepest part of the trench is known as Challenger …",https://photos.smugmug.com/Other/n-hRFP2/Podcast-Images/i-TK8Wttv/0/MbhQ5QMVXvVXJnF3DHxw5gxfF5fNPJTLD53g2n6cw/L/1939epart-L.jpg,2025-10-27T05:20:19Z,,"Subscribe Apple | Spotify | Amazon |iHeart Radio | Castbox | Podcast Republic | RSS | Patreon | Discord | Facebook
Located in an arc sweeping to the east and south of the Marina Islands and Guam is … [+11529 chars]",,en,'Guam'
74,https://www.bbc.com/news/articles/cge5ngz11xpo,0,www.bbc.com,"International troops won't want to enforce Gaza peace, says King of Jordan",King Abdullah tells the BBC there would need to be peace in Gaza before any international forces were deployed.,https://ichef.bbci.co.uk/news/1024/branded_news/e93e/live/0fec83d0-b0d0-11f0-ba75-093eca1ac29b.jpg,2025-10-27T06:01:02Z,,"Fergal KeaneSpecial correspondent
Watch: Would Jordan provide security inside Gaza? The country's king explains his answer to BBC Panorama
Countries would reject being asked to ""enforce"" peace in G… [+7074 chars]",,en,'United States'
75,https://www.npr.org/2025/10/27/g-s1-95164/melissa-category-5-hurricane,0,www.npr.org,Melissa strengthens to a Category 5 hurricane as it nears Jamaica,"Melissa is forecast to make landfall on the island of Jamaica Tuesday, with up to 30 inches of rain and a life-threatening storm surge. Category 5 is the highest on the Saffir-Simpson scale.",https://npr.brightspotcdn.com/dims3/default/strip/false/crop/3402x1914+0+177/resize/1400/quality/100/format/jpeg/?url=http%3A%2F%2Fnpr-brightspot.s3.amazonaws.com%2F71%2Fb0%2Fd90eb461428d87200b9284c5757f%2Fap25299817455989.jpg,2025-10-27T09:39:13Z,,"KINGSTON, Jamaica Hurricane Melissa intensified to Category 5 strength Monday as it neared Jamaica with up to 30 inches (76 centimeters) of rain and a life-threatening storm surge.
Melissa is foreca… [+3278 chars]",,en,'Jamaica'
76,https://www.usatoday.com/story/news/politics/2025/10/27/donald-trump-mri-conditions/86925576007/,0,www.usatoday.com,Trump received MRI at Walter Reed. What health conditions has he been diagnosed with?,President Donald Trump speaking with reporters on Air Force One on his way to Japan revealed he received an MRI at Walter Reed earlier this month.,https://s.yimg.com/ny/api/res/1.2/.TZgGSVvex9HNdOKCVB4OA--/YXBwaWQ9aGlnaGxhbmRlcjt3PTEyMDA7aD04MDA7Y2Y9d2VicA--/https://media.zenfs.com/en/usa_today_news_641/dd1d5351e6ed1e472d2ccfbd6d887d7e,2025-10-27T13:26:45Z,,"President Donald Trump said on Oct. 27 that he received an MRI earlier this month.
Trump went to Walter Reed National Military Medical Center on Oct. 10 for what he called his ""semi-annual physical.… [+3237 chars]",,en,'Japan'
77,https://www.businessinsider.com/best-small-towns-to-visit-florida-recommendations-from-local,0,www.businessinsider.com,I've lived in Florida for over 25 years. These 6 small towns probably aren't on your radar — but should be.,"I've lived in Florida for over 25 years and think Mount Dora, Alys Beach, and Fernandina Beach are some of the best small towns to visit in Florida.",https://i.insider.com/68473500f748d8c055f35442?width=1200&format=jpeg,2025-10-27T13:42:48Z,,"In my opinion, Fernandina Beach is one of the best small towns to visit in Florida.Sean Pavone/Shutterstock
<ul><li>I've lived in Florida for over 25 years and love exploring the state's charming sm… [+4165 chars]",,en,'nan'
78,https://www.allrecipes.com/jerky-recall-sams-club-costco-october-2025-11837388,0,www.allrecipes.com,Over 2 Million Pounds of Popular Meat Products Sold at Costco and Sam's Club Recalled for Life-Threatening Contaminant,Here's what you need to know.,https://s.yimg.com/ny/api/res/1.2/bUCToP41NawRoRUgGWmxyw--/YXBwaWQ9aGlnaGxhbmRlcjt3PTEyMDA7aD05MDA7Y2Y9d2VicA--/https://media.zenfs.com/en/all_recipes_969/6cca9234fdcb4aabb632d716c53a7bec,2025-10-27T14:31:35Z,,The U.S. Department of Agricultures Food Safety and Inspection Service (FSIS) has announced a recall on over 2 million pounds of ready-to-eat pork jerky sold at Costco and Sams Club that may be conta… [+2016 chars],,en,'West Island'
79,https://www.macrumors.com/2025/10/27/apple-says-iphone-passport-feature-coming-soon/,0,www.macrumors.com,Apple Says U.S. Passport Feature on iPhone is Coming Soon,"You will soon be able to add a digital version of your U.S. passport to your iPhone, according to Jennifer Bailey, vice president of Apple Pay and Apple Wallet.





Bailey reiterated that the feature is coming soon during her keynote at the Money20/20 USA co…",https://images.macrumors.com/t/H1SDDOSvblWea0VS2zQB3IwDIyc=/2000x/article-new/2025/06/ios-26-digital-id-passport-wallet.jpg,2025-10-27T14:41:10Z,,"You will soon be able to add a digital version of your U.S. passport to your iPhone, according to Jennifer Bailey, vice president of Apple Pay and Apple Wallet.
Bailey reiterated that the feature is… [+1229 chars]",,en,'USA'
80,https://www.forbes.com/sites/lauriewerner/2025/10/27/explore-japan-by-private-jet-tcs-world-travels-new-11-day-journey/,0,www.forbes.com,Explore Japan By Private Jet: TCS World Travel’s New 11-Day Journey,The travel company is debuting a Japan trip next June with a new Airbus A321neo-LR spotlighting off the beaten track destinations and different activities.,https://imageio.forbes.com/specials-images/imageserve/68fe73bccf5ae9da5de326e9/0x0.jpg?format=jpg&height=900&width=1600&fit=bounds,2025-10-27T15:07:23Z,,"Torii gates in Fushimi Inari Shrine, Kyoto, Japan.
Shutterstock
As exhilarating as a spin on Japans famous bullet train might be, whizzing past Mount Fuji and other parts of the countryside, anothe… [+4201 chars]",,en,'McDonald Islands'
81,https://gizmodo.com/hurricane-melissa-could-make-3-landfalls-in-3-days-ravaging-the-caribbean-2000677476,0,gizmodo.com,"Hurricane Melissa Could Make 3 Landfalls in 3 Days, Ravaging the Caribbean","As Jamaica braces for what may be the most powerful storm in the island nation’s history, Cuba and the Lucayan Archipelago may face direct hits soon after.",https://gizmodo.com/app/uploads/2025/10/Hurricane-Melissa-1200x675.jpg,2025-10-27T15:07:49Z,,"Category 5 Hurricane Melissa is barreling toward Jamaica after rapidly intensifying with unprecedented speed over the weekend. Forecasters warn this storm could dump up to 40 inches (1,000 millimeter… [+4080 chars]",,en,'Jamaica'
82,https://www.aljazeera.com/news/2025/10/27/hurricane-melissa-where-and-when-will-it-make-landfall-in-jamaica,0,www.aljazeera.com,Hurricane Melissa: Where and when will it make landfall in Jamaica?,Melissa has strengthened into a major Category 5 storm. Here's what that means.,https://www.aljazeera.com/wp-content/uploads/2025/10/afp_68ff7718eab8-1761572632.jpg?resize=1920%2C1031&quality=80,2025-10-27T15:32:06Z,,"Hurricane Melissa, which has been barrelling towards Jamaica, is expected to be the most powerful hurricane to ever make a direct hit on the island.
The hurricane intensified on Monday into a Catego… [+4530 chars]",,en,'Jamaica'
83,https://www.vanityfair.com/style/story/queen-camilla-hot-equerry-ollie-plunkett,0,www.vanityfair.com,Queen Camilla’s “Hot Equerry” Wins a Legion of Fans After Rare Vatican Visit,Major Ollie Plunket is a sporty military man and trusted member of the royal inner circle—but is the internet’s new favorite officer single?,"https://media.vanityfair.com/photos/68ff8fe4d9b781af60fdd744/16:9/w_1280,c_limit/2148865250",2025-10-27T15:54:13Z,,"Major Oliver Plunket accompanies Queen Camilla as she visits the 95th Field of Remembrance at Westminster Abbey on November 9, 2023 in London, England.
Max Mumby/Indigo/Getty Images
Major Plunket h… [+1547 chars]",,en,'Vatican'
84,https://www.theverge.com/tech/806243/fitbit-ai-health-coach-app-update-preview,0,www.theverge.com,Fitbit’s overhauled app and AI health coach arrive today,"Fitbit's new Gemini-powered health coach is debuting in preview today, as part of an entirely new app experience that was announced back in August. Premium subscribers in the US on Android will have access to it first as it starts rolling out today, with plan…",https://platform.theverge.com/wp-content/uploads/sites/2/2025/08/fitbithealthcoach.jpg?quality=90&strip=all&crop=0%2C10.732984293194%2C100%2C78.534031413613&w=1200,2025-10-27T16:22:17Z,,"<ul><li></li><li></li><li></li></ul>
Premium subscribers can opt in and try out the new features.
Premium subscribers can opt in and try out the new features.
by
Allison JohnsonClose
Allison Joh… [+3985 chars]",,en,'US'
85,https://www.theverge.com/news/807483/amd-department-of-energy-announce-1-billion-ai-supercomputer-partnership,0,www.theverge.com,"AMD, Department of Energy announce $1 billion AI supercomputer partnership","AMD has sealed a $1 billion deal with the US Department of Energy to develop two supercomputers, Lux and Discovery, in collaboration with Oracle and Hewlett Packard Enterprise (HPE). Both supercomputers will live at Oak Ridge National Laboratory (ORNL) in Oak…","https://platform.theverge.com/wp-content/uploads/sites/2/2025/03/acastro_STK081_amd_02.jpg.webp?quality=90&strip=all&crop=0,10.654292878952,100,78.691414242097",2025-10-27T22:16:48Z,,"<ul><li></li><li></li><li></li></ul>
Oak Ridge National Laboratory is getting two new supercomputers powered by AMD chips.
Oak Ridge National Laboratory is getting two new supercomputers powered by… [+2822 chars]",,en,'US'
86,https://www.cbc.ca/news/world/livestory/hurricane-melissa-moves-across-jamaica-battering-island-with-winds-and-heavy-rain-9.6956506,0,www.cbc.ca,"Hurricane Melissa moves across Jamaica, battering island with winds and heavy rain",,"https://i.cbc.ca/ais/deec934a-dc2d-4ce1-b3e5-0fb5802204c2,1761660417115/full/max/0/default.jpg?im=Crop%2Crect%3D%280%2C134%2C3000%2C1687%29%3BResize%3D620",2025-10-27T22:21:08Z,,"After their flight home from Jamaica on Sunday was cancelled, Stephanie Brayford and her family are now sheltering in place in a hotel conference room in Negril on the islands west coast. 
The storm… [+557 chars]",,en,'Jamaica'
87,https://www.juancole.com/2025/10/trump-golfing-while.html,0,www.juancole.com,King Trump: Golfing while Rome Burns,"( Tomdispatch.com ) - Yes, in the ever more ominously unsettled (dis-)United States of Donald J. Trump, I recently went to the “hate America” rally in New York City. Or at least that’s what Republican Speaker of the House of Representatives Mike Johnson insis…",https://media.juancole.com/images/2022/08/Screen-Shot-2022-te08-04-at-12.34.28-PM.png,2025-10-28T04:04:51Z,,"( Tomdispatch.com ) – Yes, in the ever more ominously unsettled (dis-)United States of Donald J. Trump, I recently went to the “hate America” rally in New York City. Or at least that’s what Republica… [+10774 chars]",,en,'Antarctica'
88,https://www.cbc.ca/news/canada/ottawa/repatriation-of-indigenous-items-held-at-the-vatican-needs-to-be-done-the-right-way-say-local-first-nations-9.6955840,0,www.cbc.ca,"Repatriation of Indigenous items held at the Vatican needs to be done the right way, say First Nations","Indigenous communities in Canada believe the return of cultural objects from the Vatican Museum is a step towards reconciliation, but some stress that the items must be returned in a manner that reflects their sacred nature, including holding ceremonies for o…","https://i.cbc.ca/ais/1.7398275,1733080301000/full/max/0/default.jpg?im=Crop%2Crect%3D%282%2C0%2C1193%2C671%29%3BResize%3D620",2025-10-28T08:00:00Z,,"Gilbert Whiteduck says the repatriation of Indigenous items from the Vatican museum is an important step towards reconciliation, but the handling of those items needs to be done in a manner that refl… [+3687 chars]",,en,'Vatican'
89,https://www.techradar.com/how-to-watch/tennis/paris-masters-2025-free,0,www.techradar.com,"How to watch Paris Masters 2025: live stream tennis online for FREE, start time, what TV channel?","Watch free tennis streams today as Sinner and Alcaraz compete in the season's last Masters event – 2025 Paris Masters TV channels, broadcasters and streams.",https://cdn.mos.cms.futurecdn.net/3LhAEJ2q8fEs2tTpaDaAQN-1024-80.jpg,2025-10-28T08:00:00Z,,"<ul><li>Paris Masters 2025: Monday, October 27 to Sunday, November 2</li><li>Daily start time: 6am ET / 10am GMT</li><li>Free stream: France TV (France)</li><li>Unlock the free stream using ExpressVP… [+11264 chars]",,en,'Vatican City'
90,https://variety.com/2025/film/global/tla-releasing-alief-tallinn-the-activist-1236563197/,0,variety.com,Alief’s Queer Neo-Noir ‘The Activist’ Sells to TLA Releasing for North America and HBO Max for the Baltics Ahead of Tallinn (EXCLUSIVE),"French-U.K. genre-bending Alief sales outfit has sealed multiple deals covering nearly 20 territories on Romas Zabarauskas’ gay neo-noir “The Activist,” ahead of the pic’s international premiere at Tallinn Black Nights Film Festival (PÖFF)’s Baltic competitio…",https://variety.com/wp-content/uploads/2025/10/1_The_Activist_still_Robertas_Petraitis.jpg?w=1000&h=563&crop=1,2025-10-28T09:37:13Z,,"French-U.K. genre-bending Alief sales outfit has sealed multiple deals covering nearly 20 territories on Romas Zabarauskas’ gay neo-noir “The Activist,” ahead of the pic’s international premiere at T… [+2841 chars]",,en,'Tallinn'
91,https://www.yahoo.com/news/articles/federal-agents-daring-plan-recruit-115713137.html,0,www.yahoo.com,A federal agent's daring plan: Recruit Maduro's pilot to turn on the Venezuelan leader,The federal agent had a daring pitch for Nicolás Maduro’s chief pilot: All he had to do was surreptitiously divert the Venezuelan president’s plane to a...,https://s.yimg.com/ny/api/res/1.2/efbw8xkl4p1TX0jJEdLUMg--/YXBwaWQ9aGlnaGxhbmRlcjt3PTEyMDA7aD04MDA7Y2Y9d2VicA--/https://media.zenfs.com/en/ap.org/d1f546f04f1099717362b96a70a39ba9,2025-10-28T11:57:13Z,,MIAMI (AP) The federal agent had a daring pitch for Nicolás Maduros chief pilot: All he had to do was surreptitiously divert the Venezuelan presidents plane to a place where U.S. authorities could na… [+12575 chars],,en,'Venezuela'
92,https://weather.com/storms/hurricane/news/2025-10-28-hurricane-melissa-live-blog-updates-jamaica-landfall,0,weather.com,Hurricane Melissa Live Updates: Category 5 Landfall Imminent As Jamaica Takes Cover,"The storm has grown stronger than Katrina, and is threatening to be the Atlantic's first Category 5 landfall since 2019.",https://s.yimg.com/ny/api/res/1.2/hpuUL7IoXnckEzrdEPYEBw--/YXBwaWQ9aGlnaGxhbmRlcjt3PTEyMDA7aD02NzU7Y2Y9d2VicA--/https://media.zenfs.com/en/the_weather_channel_articles_180/3376dcaa329a97d7190ffab40995d8e7,2025-10-28T12:55:00Z,,"If you have questions about Melissa, you can text us at (404) 793-7182.
We're just hours away from a historic landfall, as Hurricane Melissa closes in on Jamaica at Category 5 intensity. Below, you … [+7244 chars]",,en,'Jamaica'
93,https://thepointsguy.com/news/hurricane-melissa-travel-to-jamaica-caribbean/,0,thepointsguy.com,Hurricane Melissa: What to know about the catastrophic storm's impact on travel to the Caribbean,"Hurricane Melissa is predicted to make landfall in Jamaica as a powerful Category 5 storm, causing catastrophic damage to the Caribbean island.",https://runway-media-production.global.ssl.fastly.net/us/originals/2025/10/Satellite-image-provided-by-the-National-Oceanic-and-Atmospheric-Administration-NOAA-Hurricane-Melissa-churns-northwest-through-the-Caribbean_-NOAA-via-Getty-Images.jpg,2025-10-28T13:04:51Z,,"Hurricane Melissa is predicted to make landfall in Jamaica on Tuesday morning as a Category 5 storm with 175 mph winds, making it the most powerful storm in the Atlantic Ocean this year.
The storm's… [+7809 chars]",,en,'West Island'
94,https://phys.org/news/2025-10-scientists-extinct-rhino-species-canada.html,0,phys.org,Scientists describe an extinct rhino species from Canada's High Arctic,Scientists from the Canadian Museum of Nature have announced the discovery and description of an extinct rhinoceros from the Canadian High Arctic. The nearly complete fossil skeleton of the new species was recovered from the fossil-rich lake deposits in Haugh…,https://scx2.b-cdn.net/gfx/news/hires/2025/canadian-scientists-de.jpg,2025-10-28T16:00:01Z,,Scientists from the Canadian Museum of Nature have announced the discovery and description of an extinct rhinoceros from the Canadian High Arctic. The nearly complete fossil skeleton of the new speci… [+7005 chars],,en,'Canada'
95,https://www.bbc.com/news/articles/c2drjx9r0l8o,0,www.bbc.com,'We're absolutely terrified': Millions brace for Hurricane Melissa's impact in Jamaica,"As the world's strongest storm of the year closes in on Jamaica, people describe frantic preparations.",https://ichef.bbci.co.uk/news/1024/branded_news/2e8e/live/42c145b0-b419-11f0-8af8-23f34058d4bc.jpg,2025-10-28T16:43:58Z,,"Waves crash on to the Kingston waterfront
""The trees are snapping, the wind is slamming into our rooms and the rain is relentless.""
Keira Witcomb is among millions of locals and tourists awaiting t… [+4256 chars]",,en,'Jamaica'
96,https://www.theverge.com/report/808104/fcc-order-retroactive-ban-transmitter-national-security,0,www.theverge.com,The FCC just gave itself the power to make a DJI drone ban stick,"This morning, the Federal Communications Commission (FCC) voted 3-0 to let itself retroactively ban gadgets and radio components that it previously approved for entry into the United States, if the company that makes them is deemed a national security risk. O…",https://platform.theverge.com/wp-content/uploads/sites/2/2025/09/mini-5-pro-close.jpg?quality=90&strip=all&crop=0%2C11.900470941093%2C100%2C76.199058117814&w=1200,2025-10-28T18:33:17Z,,"<ul><li></li><li></li><li></li></ul>
It will retroactively ban gadgets from companies on its Covered List.
It will retroactively ban gadgets from companies on its Covered List.
by
Sean HollisterC… [+6276 chars]",,en,'US'
97,https://nofilmschool.com/best-movies-about-the-suburbs,0,nofilmschool.com,"15 Movies About the Suburbs That Are Surprisingly Dark, Funny, and True","I've been on a kick lately, trying to watch movies to prepare for a new spec I am writing about growing up in the suburbs. That means I've been gobbling up all Hollywood has to offer when dissecting suburbia. And while the American Suburb is a symbol of peace…",https://nofilmschool.com/media-library/image.jpg?id=61954997&width=1200&height=600&coordinates=0%2C57%2C0%2C57,2025-10-28T20:50:04Z,,"I've been on a kick lately, trying to watch movies to prepare for a new spec I am writing about growing up in the suburbs. That means I've been gobbling up all Hollywood has to offer when dissecting … [+11671 chars]",,en,'Hollywood'
98,https://www.nature.com/articles/s41586-025-09625-4,0,www.nature.com,Magnetotelluric evidence for a melt-rich magmatic reservoir beneath Mayotte,Magnetotelluric data provide evidence of a large melt-rich magmatic reservoir beneath Mayotte island that might be connected to the system that fed the large submarine eruption of Fani Maoré in 2018–2019.,https://media.springernature.com/m685/springer-static/image/art%3A10.1038%2Fs41586-025-09625-4/MediaObjects/41586_2025_9625_Fig1_HTML.png,2025-10-29T00:00:00Z,,"<li>Cashman, K. V., Sparks, R. S. J. &amp; Blundy, J. D. Vertically extensive and unstable magmatic systems: a unified view of igneous processes. Science355, eaag3055 (2017).
Article 
 PubMed 
Goo… [+14221 chars]",,en,'Antarctica'
99,https://www.npr.org/2025/10/29/nx-s1-5589717/hurricane-melissa-landfall-cuba-category-3-storm,0,www.npr.org,Hurricane Melissa makes landfall in eastern Cuba as a Category 3 storm,Hurricane Melissa made landfall in eastern Cuba near the city of Chivirico early Wednesday as a Category 3 storm after pummeling Jamaica.,https://npr.brightspotcdn.com/dims3/default/strip/false/crop/5217x2935+0+272/resize/1400/quality/100/format/jpeg/?url=http%3A%2F%2Fnpr-brightspot.s3.amazonaws.com%2F9d%2F67%2F1201ebb14b0b9fd1485a9cdea66e%2Fap25301701595090.jpg,2025-10-29T08:20:35Z,,"SANTIAGO DE CUBA, Cuba Hurricane Melissa made landfall in eastern Cuba near the city of Chivirico early Wednesday as a Category 3 storm after pummeling Jamaica as one of the strongest Atlantic hurric… [+2827 chars]",,en,'West Island'
100,https://www.bbc.com/news/articles/c5yl09v025lo,0,www.bbc.com,"Jamaicans wake to devastation after hurricane causes floods, power cuts and splits city in two","With communication networks in Jamaica crippled, the true scale of the disaster remains unknown.",https://ichef.bbci.co.uk/news/1024/branded_news/cffc/live/1c03cf10-b4b4-11f0-b245-913f6e55314b.jpg,2025-10-29T10:34:51Z,http://web.archive.org/web/20251102101934/https://www.bbc.com/news/articles/c5yl09v025lo,"Many parts of the island are either under water or have homes destroyed by the strong winds
The normal soundtrack that accompanies Jamaican life is silent this morning as many have woken to no elect… [+6102 chars]",,en,'Jamaica'
101,https://www.forbes.com/sites/vickysmith/2025/10/29/nicaragua-is-a-magical-christmas-vacation-with-parades-and-winter-sun/,0,www.forbes.com,Nicaragua Is A Magical Christmas Vacation—With Parades And Winter Sun,"Searching for some winter sun, complete with a dusting of Christmas magic? Nicaragua might just be the ticket...",https://imageio.forbes.com/specials-images/imageserve/6901e3e913b80141ef3213aa/0x0.jpg?format=jpg&height=900&width=1600&fit=bounds,2025-10-29T11:06:32Z,,"The view from Granadas Iglesia de la Merced, or Church of Mercy
Vicky Smith
Nicaragua isnt an obvious vacation destination. It suffers from the reputation of its tumultuous pastincluding the Nicara… [+5287 chars]",,en,'Christmas Island'
